{
  "schema_version": "1.0.0",
  "record_type": "controlled_experience_descriptor_catalogue",
  "catalogue_id": "XDC-000000",
  "metadata_only": true,
  "catalogue_state": "active_empty",
  "dimensions": {
    "domain": {"minimum_count": 1, "maximum_count": 3, "values": []},
    "record_kind": {"minimum_count": 1, "maximum_count": 1, "values": []},
    "task_trigger": {"minimum_count": 0, "maximum_count": 5, "values": []},
    "target_object": {"minimum_count": 0, "maximum_count": 5, "values": []},
    "scope": {"minimum_count": 1, "maximum_count": 1, "values": []}
  }
}
